{
  "name": "VinuChain",
  "website": "https://vinuchain.com",
  "description": "VinuChain core protocol contracts including the Special Fee Contract (SFC) for staking and validator management",
  "contact": "hello@vinuchain.com",
  "security": "hello@vinuchain.com",
  "contracts": [
    {
      "name": "SFC",
      "address": "0xFC00FACE00000000000000000000000000000000",
      "type": "staking",
      "description": "Special Fee Contract — manages validator creation, stake delegation, epoch rewards, lockups, and slashing"
    },
    {
      "name": "NodeDriverAuth",
      "address": "0xD100ae0000000000000000000000000000000000",
      "type": "system",
      "description": "Owner-controlled governance contract for network administration — queues and executes time-locked migrations, network rule updates, epoch advances, and nonce increments"
    },
    {
      "name": "NodeDriver",
      "address": "0xd100A01E00000000000000000000000000000000",
      "type": "system",
      "description": "EVM-facing relay contract between NodeDriverAuth and the EvmWriter precompile — emits canonical events for validator weight/pubkey changes, network rule updates, and epoch advances"
    }
  ],
  "social": {
    "github": "https://github.com/VinuChain",
    "twitter": "https://x.com/vinuchain",
    "telegram": "https://t.me/vinuchain",
    "discord": "https://discord.gg/vinu"
  }
}
